{
  "name": "places/ChIJN1t_tDeuEmsRUsoyG83frY4",
  "id": "ChIJN1t_tDeuEmsRUsoyG83frY4",
  "displayName": {
    "text": "Google Building 40",
    "languageCode": "en"
  },
  "types": [
    "restaurant"
  ],
  "primaryType": "restaurant",
  "formattedAddress": "1600 Amphitheatre Pkwy, Mountain View, CA 94043, USA",
  "shortFormattedAddress": "1600 Amphitheatre Pkwy, Mountain View, CA 94043, USA",
  "location": {
    "latitude": -17.2202,
    "longitude": -135.8032
  },
  "rating": 4.6,
  "userRatingCount": 124,
  "priceLevel": "PRICE_LEVEL_EXPENSIVE",
  "businessStatus": "CLOSED_TEMPORARILY",
  "nationalPhoneNumber": "+1 650-253-0000",
  "internationalPhoneNumber": "+1 650-253-0000",
  "websiteUri": "https://maps.google.com/?cid=12345678901234567890",
  "googleMapsUri": "https://maps.google.com/?cid=12345678901234567890",
  "regularOpeningHours": {
    "openNow": true,
    "periods": [
      {
        "open": {
          "day": 5,
          "hour": 17,
          "minute": 0
        },
        "close": {
          "day": 5,
          "hour": 8,
          "minute": 45
        }
      }
    ],
    "weekdayDescriptions": [
      "Monday: 9:00 AM - 5:00 PM"
    ]
  },
  "photos": [
    {
      "name": "places/ChIJN1t_tDeuEmsRUsoyG83frY4",
      "widthPx": 1920,
      "heightPx": 1080,
      "authorAttributions": [
        {
          "displayName": "Googleplex",
          "uri": "https://maps.google.com/?cid=12345678901234567890",
          "photoUri": "https://places.googleapis.com/v1/places/ChIJ/photos/AeJ/media"
        }
      ]
    }
  ],
  "reviews": [
    {
      "name": "places/ChIJN1t_tDeuEmsRUsoyG83frY4",
      "rating": 4.9,
      "text": {
        "text": "Google Building 40",
        "languageCode": "en"
      },
      "originalText": {
        "text": "Google Building 40",
        "languageCode": "en"
      },
      "relativePublishTimeDescription": "Monday: 9:00 AM - 5:00 PM",
      "publishTime": "2026-03-15T14:30:00Z",
      "authorAttribution": {
        "displayName": "Googleplex",
        "uri": "https://maps.google.com/?cid=12345678901234567890",
        "photoUri": "https://places.googleapis.com/v1/places/ChIJ/photos/AeJ/media"
      }
    }
  ]
}